{
  "$schema": "../theme.schema.json",
  "name": "thermite",
  "description": "rust, aluminum and molten iron: soot and ash grounds, a molten-orange accent, aluminum blue as the cool counterpoint",
  "dark": {
    "bg": "#120e0c",
    "surface": "#1c1613",
    "raised": "#28201b",
    "line": "#3d3029",
    "text": "#f6ede3",
    "muted": "#b9a797",
    "faint": "#7a685b",
    "accent": "#ff7a1f",
    "accent-ink": "#1a0e06",
    "focus": "#ffc24a",
    "ok": "#7fd18b",
    "busy": "#ffc24a",
    "bad": "#ff5c4a",
    "info": "#8ec3d6",
    "flame": "#ff5a1f",
    "glow": "#ffa62b",
    "core": "#fff1c9",
    "spark": "#ffe08a",
    "metal": "#a3afb7",
    "metal-shade": "#5f6c75",
    "hues": ["#8ec3d6", "#7fd18b", "#d2a4ec", "#ffc24a", "#ff8a4c"]
  },
  "light": {
    "bg": "#faf5ee",
    "surface": "#f2eadf",
    "raised": "#ffffff",
    "line": "#e0d3c2",
    "text": "#23170f",
    "muted": "#6b5646",
    "faint": "#a08b79",
    "accent": "#c2410c",
    "accent-ink": "#ffffff",
    "focus": "#b45309",
    "ok": "#2e7d32",
    "busy": "#9a6700",
    "bad": "#c62828",
    "info": "#2f6577",
    "flame": "#e4570f",
    "glow": "#f59e0b",
    "core": "#ffe7a8",
    "spark": "#f59e0b",
    "metal": "#5b6b75",
    "metal-shade": "#34414a",
    "hues": ["#2f6577", "#2e7d32", "#7b3fa0", "#9a6700", "#c2410c"]
  }
}
